{
  "fixture_key": "fmp:ratings:ACME",
  "provider": "fmp",
  "captured_at": "2026-06-11T00:00:00Z",
  "request": {
    "symbol": "ACME",
    "live_network": false
  },
  "metadata": {
    "schema": "schemas/fmp_ratings_v1.schema.json",
    "provenance": {
      "source": "synthetic-offline-fixture",
      "captured_at": "2026-06-11T00:00:00Z",
      "live_network": false,
      "redacted": true
    },
    "capability": "finance.vendor.fmp.ratings",
    "rate_limit": {
      "policy": "metadata-only",
      "window_seconds": 86400,
      "limit": 300,
      "retry_after_seconds": 2
    },
    "terms": {
      "usage": "offline-fixture-only",
      "attribution": "provider terms metadata retained",
      "redistribution": "do-not-redistribute-live-payloads",
      "live_network": false
    }
  },
  "payload": {
    "symbol": "ACME",
    "rating": "A-",
    "score": 4,
    "recommendation": "Buy",
    "details": {
      "dcf_score": 4,
      "roe_score": 5,
      "debt_score": 3
    }
  }
}
